{
  "chunk_duration_s": 1.0,
  "chunk_index": 0,
  "drop_count": 0,
  "error_message": null,
  "error_stage": null,
  "fallback_applied": false,
  "health_reason": "runtime operating normally",
  "health_state": "healthy",
  "infer_ms": 0.00035,
  "input": "fixture:mic-demo",
  "istft_ms": 7e-05,
  "metadata": {
    "channels": 1,
    "clock_fallback": false,
    "clock_source": "ingest",
    "device_requested": "cpu",
    "device_used": "cpu",
    "mode": "smoke",
    "sample_width_bytes": 2,
    "samples_processed": 22050,
    "stages": [
      "stft",
      "infer",
      "istft"
    ]
  },
  "model_path": "artifacts/models/umx-live.pt",
  "queue_depth": 1,
  "requested_model_path": "artifacts/models/umx-live.pt",
  "sample_rate_hz": 22050,
  "source": {
    "kind": "mic",
    "metadata": {
      "backend": "fake",
      "capture_duration_s": 1.0,
      "device": "fixture:mic-demo",
      "sample_rate_hz": 22050
    },
    "reference": "fixture:mic-demo"
  },
  "status": "ok",
  "stem_paths": {
    "bass": "artifacts/bench/s06-capstone-4jbb9L/mic-latency/bass.wav",
    "drums": "artifacts/bench/s06-capstone-4jbb9L/mic-latency/drums.wav",
    "other": "artifacts/bench/s06-capstone-4jbb9L/mic-latency/other.wav",
    "vocals": "artifacts/bench/s06-capstone-4jbb9L/mic-latency/vocals.wav"
  },
  "stft_ms": 0.047437,
  "timestamp": "2026-04-20T22:30:15.566800+00:00",
  "total_ms": 0.047857
}
