{
  "chunk_duration_s": 0.5,
  "chunk_index": 20,
  "drop_count": 0,
  "error_message": null,
  "error_stage": null,
  "fallback_applied": false,
  "health_reason": "runtime operating normally",
  "health_state": "healthy",
  "infer_ms": 0.000559,
  "input": "fixtures/video/demo_mix.mp4",
  "istft_ms": 0.000115,
  "metadata": {
    "channels": 1,
    "clock_fallback": false,
    "clock_source": "ingest",
    "device_requested": "cpu",
    "device_used": "cpu",
    "mode": "smoke",
    "sample_width_bytes": 2,
    "samples_processed": 220672,
    "stages": [
      "stft",
      "infer",
      "istft"
    ]
  },
  "model_path": "artifacts/models/umx-live.pt",
  "queue_depth": 21,
  "requested_model_path": "artifacts/models/umx-live.pt",
  "sample_rate_hz": 22050,
  "source": {
    "kind": "video_audio",
    "metadata": {
      "container": "mp4"
    },
    "reference": "fixtures/video/demo_mix.mp4"
  },
  "status": "ok",
  "stem_paths": {
    "bass": "artifacts/live/s03-verify-gM8E9X/video-audio-source-mode/bass.wav",
    "drums": "artifacts/live/s03-verify-gM8E9X/video-audio-source-mode/drums.wav",
    "other": "artifacts/live/s03-verify-gM8E9X/video-audio-source-mode/other.wav",
    "vocals": "artifacts/live/s03-verify-gM8E9X/video-audio-source-mode/vocals.wav"
  },
  "stft_ms": 29.895523,
  "timestamp": "2026-05-05T17:38:44.939786+00:00",
  "total_ms": 29.896197
}
