{
  "chunk_duration_s": 0.5,
  "chunk_index": 0,
  "drop_count": 0,
  "error_message": "ffmpeg executable not found; install imageio-ffmpeg or provide ffmpeg on PATH",
  "error_stage": "decode_failed",
  "fallback_applied": false,
  "health_reason": "ffmpeg executable not found; install imageio-ffmpeg or provide ffmpeg on PATH",
  "health_state": "degraded",
  "infer_ms": 0.0,
  "input": "/mnt/f/Github/CS4220-Capstone-Audio-Source-Separation/fixtures/audio/demo_mix.mp3",
  "istft_ms": 0.0,
  "metadata": {
    "channels": 0,
    "clock_fallback": false,
    "clock_source": "ingest",
    "device_requested": "cpu",
    "device_used": "cpu",
    "mode": "smoke",
    "sample_width_bytes": 0,
    "samples_processed": 0,
    "stages": [
      "stft",
      "infer",
      "istft"
    ]
  },
  "model_path": "artifacts/models/umx-live.pt",
  "queue_depth": 0,
  "requested_model_path": "artifacts/models/umx-live.pt",
  "sample_rate_hz": 22050,
  "source": {
    "kind": "mp3",
    "reference": "/mnt/f/Github/CS4220-Capstone-Audio-Source-Separation/fixtures/audio/demo_mix.mp3"
  },
  "status": "error",
  "stem_paths": {
    "bass": "/mnt/f/Github/CS4220-Capstone-Audio-Source-Separation/artifacts/live/one-click/bass.wav",
    "drums": "/mnt/f/Github/CS4220-Capstone-Audio-Source-Separation/artifacts/live/one-click/drums.wav",
    "other": "/mnt/f/Github/CS4220-Capstone-Audio-Source-Separation/artifacts/live/one-click/other.wav",
    "vocals": "/mnt/f/Github/CS4220-Capstone-Audio-Source-Separation/artifacts/live/one-click/vocals.wav"
  },
  "stft_ms": 0.0,
  "timestamp": "2026-05-11T04:38:26.260583+00:00",
  "total_ms": 0.0
}
