{
  "chunk_duration_s": 0.5,
  "chunk_index": 19,
  "drop_count": 0,
  "error_message": null,
  "error_stage": null,
  "fallback_applied": false,
  "health_reason": "runtime operating normally",
  "health_state": "healthy",
  "infer_ms": 0.00042,
  "input": "fixtures/audio/demo_mix.mp3",
  "istft_ms": 9e-05,
  "metadata": {
    "channels": 1,
    "clock_fallback": false,
    "clock_source": "ingest",
    "device_requested": "cpu",
    "device_used": "cpu",
    "mode": "smoke",
    "sample_width_bytes": 2,
    "samples_processed": 220500,
    "stages": [
      "stft",
      "infer",
      "istft"
    ]
  },
  "model_path": "artifacts/models/umx-live.pt",
  "queue_depth": 20,
  "requested_model_path": "artifacts/models/umx-live.pt",
  "sample_rate_hz": 22050,
  "source": {
    "kind": "mp3",
    "reference": "fixtures/audio/demo_mix.mp3"
  },
  "status": "ok",
  "stem_paths": {
    "bass": "artifacts/live/s02-smoke-WiQg7O/bass.wav",
    "drums": "artifacts/live/s02-smoke-WiQg7O/drums.wav",
    "other": "artifacts/live/s02-smoke-WiQg7O/other.wav",
    "vocals": "artifacts/live/s02-smoke-WiQg7O/vocals.wav"
  },
  "stft_ms": 21.697828,
  "timestamp": "2026-04-20T22:30:51.400725+00:00",
  "total_ms": 21.698338
}
